{"$schema":"https://json-schema.org/draft/2020-12/schema","$id":"https://ids-gaze-survey.local/contracts/event-envelope.v1.schema.json","title":"EventEnvelope","type":"object","additionalProperties":false,"required":["schema_version","event_id","experience_id","study_ids","session_id","event_type","occurred_at","payload"],"properties":{"schema_version":{"const":"1.0.0"},"event_id":{"type":"string","minLength":1},"experience_id":{"type":"string","minLength":1},"study_ids":{"type":"array","items":{"type":"string"},"uniqueItems":true},"session_id":{"type":"string","minLength":1},"participant_id":{"type":["string","null"]},"event_type":{"type":"string","minLength":1},"occurred_at":{"type":"string","format":"date-time"},"payload":{"type":"object"}}}
